[
  {
    "uid": "0f7d6f1e-5c5b-4ef7-8f7b-3a8e2d1d9c01",
    "id": "landing-centered",
    "name": "Centered Hero Composition",
    "category": "Landing Pages",
    "tags": ["hero", "full-page", "centered"],
    "descriptionEs": "Concentra una campaña en una propuesta única y lleva al visitante directamente hacia el CTA.",
    "svg": "assets/landing-centered.svg",
    "viewBox": "0 0 1000 700",
    "regions": [
      { "id": "canvas", "role": "canvas", "labelEn": "Canvas / body", "explanationEs": "Área transparente de trabajo. La trama de cuadros marca el viewport y mantiene el recorrido enfocado.", "color": "transparent", "shape": "canvas" },
      { "id": "shell-navigation", "role": "shell", "labelEn": "SHELL / NAVIGATION", "explanationEs": "Ubica la marca y permite orientación sin competir con el objetivo comercial de la campaña.", "color": "#E7ECEF", "shape": "rectangle" },
      { "id": "main-proposition", "role": "hero", "labelEn": "MAIN PROPOSITION", "explanationEs": "Explica qué se ofrece, para quién y por qué importa. Es el primer argumento de conversión.", "color": "#9DD9FF", "shape": "rectangle" },
      { "id": "support-proof", "role": "support", "labelEn": "SUPPORT / PROOF", "explanationEs": "Reduce la incertidumbre con beneficios, evidencia o señales de confianza antes de pedir la acción.", "color": "#D9EAD3", "shape": "rectangle" },
      { "id": "action-cta", "role": "action", "labelEn": "ACTION / CTA", "explanationEs": "Convierte el interés en el siguiente paso medible: contactar, registrarse, comprar o solicitar información.", "color": "#171615", "shape": "pill" }
    ]
  },
  {
    "uid": "2a0f8d4c-6e23-4aa8-9e92-5e1c7b3f4402",
    "id": "landing-split",
    "name": "Split Hero Composition",
    "category": "Landing Pages",
    "tags": ["hero", "full-page", "split", "media"],
    "descriptionEs": "Combina argumento y evidencia visual para vender un servicio sin perder claridad ni contexto.",
    "svg": "assets/landing-split.svg",
    "viewBox": "0 0 1000 700",
    "regions": [
      { "id": "canvas", "role": "canvas", "labelEn": "Canvas / body", "explanationEs": "Área transparente de trabajo que mantiene el recorrido enfocado en la campaña.", "color": "transparent", "shape": "canvas" },
      { "id": "shell-navigation", "role": "shell", "labelEn": "SHELL / NAVIGATION", "explanationEs": "Da contexto de marca y orientación básica, pero conserva la atención en el servicio promocionado.", "color": "#E7ECEF", "shape": "rectangle" },
      { "id": "message", "role": "hero", "labelEn": "MESSAGE", "explanationEs": "Presenta el argumento comercial y el beneficio principal desde el primer vistazo.", "color": "#9DD9FF", "shape": "rectangle" },
      { "id": "media-visual", "role": "media", "labelEn": "MEDIA / VISUAL", "explanationEs": "Hace tangible el servicio mediante un producto, imagen, mockup o demostración.", "color": "#E1D5E7", "shape": "rectangle" },
      { "id": "support-proof", "role": "support", "labelEn": "SUPPORT / PROOF", "explanationEs": "Conecta el mensaje con evidencia, beneficios o prueba social para facilitar la decisión.", "color": "#D9EAD3", "shape": "rectangle" },
      { "id": "action-cta", "role": "action", "labelEn": "PRIMARY CTA", "explanationEs": "Define la conversión principal de la campaña y evita que el visitante tenga que adivinar qué hacer después.", "color": "#171615", "shape": "pill" }
    ]
  },
  {
    "uid": "73c4f90b-8a71-4d63-b2e4-91f6a5c80703",
    "id": "landing-story",
    "name": "Story Flow Composition",
    "category": "Landing Pages",
    "tags": ["full-page", "story", "narrative"],
    "descriptionEs": "Construye confianza paso a paso antes de pedir la acción final de la campaña.",
    "svg": "assets/landing-story.svg",
    "viewBox": "0 0 1000 700",
    "regions": [
      { "id": "canvas", "role": "canvas", "labelEn": "Canvas / body", "explanationEs": "Área transparente de trabajo que contiene un recorrido lineal sin mezclar varias campañas.", "color": "transparent", "shape": "canvas" },
      { "id": "shell-navigation", "role": "shell", "labelEn": "SHELL / NAVIGATION", "explanationEs": "Introduce la marca y orienta el inicio del recorrido sin desviar la conversión.", "color": "#E7ECEF", "shape": "rectangle" },
      { "id": "proposition", "role": "hero", "labelEn": "1. PROPOSITION", "explanationEs": "Primer paso narrativo: define qué se ofrece, para quién y por qué merece atención.", "color": "#9DD9FF", "shape": "rectangle" },
      { "id": "proof", "role": "support", "labelEn": "2. SUPPORT / PROOF", "explanationEs": "Aporta confianza y responde a la duda natural que aparece después de conocer la propuesta.", "color": "#D9EAD3", "shape": "rectangle" },
      { "id": "media-detail", "role": "media", "labelEn": "3. MEDIA / DETAIL", "explanationEs": "Permite visualizar el servicio y convertir una promesa abstracta en algo comprensible.", "color": "#E1D5E7", "shape": "rectangle" },
      { "id": "benefits", "role": "support", "labelEn": "4. BENEFITS", "explanationEs": "Traduce la propuesta en resultados concretos para ayudar al visitante a justificar su decisión.", "color": "#D9EAD3", "shape": "rectangle" },
      { "id": "final-cta", "role": "action", "labelEn": "FINAL CTA", "explanationEs": "Cierra el recorrido con una acción clara y medible alineada con el objetivo de la campaña.", "color": "#171615", "shape": "pill" }
    ]
  },
  {
    "uid": "a1b2c3d4-e5f6-4789-9012-3456789abcde",
    "id": "hero-minimal",
    "name": "Minimal Hero Composition",
    "category": "Landing Pages",
    "tags": ["hero", "minimal", "centered"],
    "descriptionEs": "Concentra el hero en una propuesta breve y una única acción sin añadir secciones auxiliares.",
    "svg": "assets/hero-minimal.svg",
    "viewBox": "0 0 1000 700",
    "regions": [
      { "id": "canvas", "role": "canvas", "labelEn": "Canvas / body", "explanationEs": "Área transparente de trabajo que delimita la composición del hero.", "color": "transparent", "shape": "canvas" },
      { "id": "hero-minimal", "role": "hero", "labelEn": "HERO / MINIMAL", "explanationEs": "Hero autosuficiente que concentra la propuesta, el contexto mínimo y la acción principal en un solo bloque.", "color": "#9DD9FF", "shape": "rectangle" }
    ]
  },
  {
    "uid": "b2c3d4e5-f678-4901-2abc-3456789abcde",
    "id": "hero-editorial",
    "name": "Editorial Hero Composition",
    "category": "Landing Pages",
    "tags": ["hero", "editorial", "split"],
    "descriptionEs": "Usa un mensaje editorial fuerte y un campo visual desplazado dentro del mismo hero.",
    "svg": "assets/hero-editorial.svg",
    "viewBox": "0 0 1000 700",
    "regions": [
      { "id": "canvas", "role": "canvas", "labelEn": "Canvas / body", "explanationEs": "Área transparente de trabajo que delimita la composición del hero.", "color": "transparent", "shape": "canvas" },
      { "id": "hero-editorial", "role": "hero", "labelEn": "HERO / EDITORIAL", "explanationEs": "Hero único que combina un argumento editorial y una referencia visual sin crear una sección independiente.", "color": "#9DD9FF", "shape": "rectangle" }
    ]
  },
  {
    "uid": "c3d4e5f6-7890-4abc-3def-456789abcdef",
    "id": "hero-asymmetric",
    "name": "Asymmetric Hero Composition",
    "category": "Landing Pages",
    "tags": ["hero", "asymmetric", "visual"],
    "descriptionEs": "Desplaza el mensaje y el ancla visual dentro de un único hero para crear tensión compositiva.",
    "svg": "assets/hero-asymmetric.svg",
    "viewBox": "0 0 1000 700",
    "regions": [
      { "id": "canvas", "role": "canvas", "labelEn": "Canvas / body", "explanationEs": "Área transparente de trabajo que delimita la composición del hero.", "color": "transparent", "shape": "canvas" },
      { "id": "hero-asymmetric", "role": "hero", "labelEn": "HERO / ASYMMETRIC", "explanationEs": "Hero único que usa un mensaje desplazado y un ancla visual para crear jerarquía sin secciones adicionales.", "color": "#9DD9FF", "shape": "rectangle" }
    ]
  },
  {
    "uid": "d4e5f678-9012-4abc-def3-456789abcdef",
    "id": "hero-fullbleed-image",
    "name": "Full-Bleed Image Hero",
    "category": "Landing Pages",
    "tags": ["hero", "full-bleed", "image"],
    "descriptionEs": "Coloca una imagen a sangre como protagonista del hero y superpone el mensaje de entrada.",
    "svg": "assets/hero-fullbleed-image.svg",
    "viewBox": "0 0 1000 700",
    "regions": [{ "id": "canvas", "role": "canvas", "labelEn": "Canvas / body", "explanationEs": "Área de trabajo del patrón.", "color": "transparent", "shape": "canvas" }, { "id": "hero-fullbleed-image", "role": "hero", "labelEn": "HERO / FULL-BLEED IMAGE", "explanationEs": "Hero cuyo campo visual ocupa todo el bloque principal.", "color": "#9DD9FF", "shape": "rectangle" }]
  },
  {
    "uid": "e5f67890-12ab-4cde-f345-6789abcdef01",
    "id": "hero-video",
    "name": "Video Hero",
    "category": "Landing Pages",
    "tags": ["hero", "video", "media"],
    "descriptionEs": "Organiza el primer impacto alrededor de un viewport de vídeo y una acción de reproducción.",
    "svg": "assets/hero-video.svg",
    "viewBox": "0 0 1000 700",
    "regions": [{ "id": "canvas", "role": "canvas", "labelEn": "Canvas / body", "explanationEs": "Área de trabajo del patrón.", "color": "transparent", "shape": "canvas" }, { "id": "hero-video", "role": "hero", "labelEn": "HERO / VIDEO", "explanationEs": "Hero centrado en una pieza audiovisual como argumento principal.", "color": "#9DD9FF", "shape": "rectangle" }]
  },
  {
    "uid": "f6789012-3abc-4def-4567-89abcdef0123",
    "id": "hero-product-showcase",
    "name": "Product Showcase Hero",
    "category": "Landing Pages",
    "tags": ["hero", "product", "showcase"],
    "descriptionEs": "Presenta el producto como el ancla visual principal del primer bloque.",
    "svg": "assets/hero-product-showcase.svg",
    "viewBox": "0 0 1000 700",